[
  {
    "id": "2026-09-18-hilton-tokyo-autumn-lunch",
    "category": "family_event",
    "title": "ヒルトン東京 オータムランチビュッフェ",
    "startDate": "2026-09-18",
    "endDate": "2026-11-12",
    "venueName": "ヒルトン東京 マーブルラウンジ",
    "address": "東京都新宿区西新宿6丁目6-2",
    "lat": 35.692528,
    "lng": 139.691056,
    "price": 6900,
    "priceNote": "土日祝 大人6,900円、平日 大人6,200円。4〜12歳は土日祝4,000円、平日3,600円。",
    "stayHours": 2,
    "reservation": "recommended",
    "targetAge": "家族向け（4〜12歳子ども料金あり）",
    "tags": [
      "hotel",
      "buffet",
      "lunch",
      "anniversary",
      "indoor"
    ],
    "summary": "秋の味覚とロースト料理などを楽しめる期間限定ランチビュッフェ。誕生日・記念日のメッセージケーキにも対応。",
    "sourceUrl": "https://tokyo.hiltonjapan.co.jp/restaurants/lp/marble-lounge-lunch-buffet",
    "retrievedDate": "2026-09-21",
    "officialSource": true
  },
  {
    "id": "2026-09-19-pokemon-athlete-waza",
    "category": "kodomoto",
    "title": "ポケモンとアスリートのわざ展",
    "startDate": "2026-09-19",
    "endDate": "2026-11-23",
    "venueName": "日本オリンピックミュージアム 1階 ウェルカムサロン",
    "address": "東京都新宿区霞ヶ丘町4-2 JAPAN SPORT OLYMPIC SQUARE",
    "lat": 35.674901,
    "lng": 139.715116,
    "price": 0,
    "stayHours": 1,
    "reservation": "not_required",
    "tags": [
      "pokemon",
      "sports",
      "hands_on",
      "indoor"
    ],
    "summary": "競技用具に触れたり、ポケモンとアスリートのポーズを真似して撮影したりしながらスポーツの「わざ」を体験できる企画展。",
    "character": "pokemon",
    "sourceUrl": "https://www.joc.or.jp/news/20260904_01.html",
    "retrievedDate": "2026-09-21",
    "officialSource": true
  },
  {
    "id": "2026-10-01-shinjuku-prince-autumn-buffet",
    "category": "family_event",
    "title": "新宿プリンスホテル 秋穫祭 ビストロブッフェ",
    "startDate": "2026-10-01",
    "endDate": "2026-11-30",
    "venueName": "新宿プリンスホテル ブッフェダイニング プリンスマルシェ",
    "address": "東京都新宿区歌舞伎町1丁目30-1",
    "lat": 35.6947173,
    "lng": 139.7001158,
    "price": 5000,
    "priceNote": "ランチは大人5,000円、会員4,400円、小学生2,500円、4歳〜未就学児1,500円。別途サービス料13%。",
    "stayHours": 2,
    "reservation": "recommended",
    "targetAge": "家族向け（小学生・幼児料金あり）",
    "tags": [
      "hotel",
      "buffet",
      "lunch",
      "seasonal",
      "indoor"
    ],
    "summary": "秋刀魚・秋鮭・鴨肉・茸などの秋の料理と、栗・さつまいも・柿・洋梨などのスイーツを楽しめる秋限定ブッフェ。ランチは安曇野げんき豚のカッティングサービスも。",
    "sourceUrl": "https://www.princehotels.co.jp/shinjuku/plan/princemarche/autumn_fair2026/",
    "retrievedDate": "2026-10-03",
    "officialSource": true,
    "notes": "ランチは11:30〜15:00（L.O.14:30）。仕入れ等により内容変更の場合あり。"
  },
  {
    "id": "2026-10-17-nakano-flower-green-festival",
    "category": "kodomoto",
    "title": "中野区花と緑の祭典2026秋",
    "startDate": "2026-10-17",
    "endDate": "2026-10-18",
    "venueName": "中野四季の森公園",
    "address": "東京都中野区中野4丁目13",
    "lat": 35.707914,
    "lng": 139.661357,
    "price": 0,
    "priceNote": "入場無料。リース作り200円、寄せ植え教室500円など一部体験は有料。",
    "stayHours": 3,
    "reservation": "not_required",
    "targetAge": "家族向け（子ども向けの草花あそびあり）",
    "tags": [
      "festival",
      "hands_on",
      "craft",
      "workshop",
      "outdoor"
    ],
    "summary": "草花あそび、園内を巡るミニグリーンアドベンチャー、寄せ植えやリース作り、花と緑のクイズなどを楽しめる。",
    "sourceUrl": "https://www.city.tokyo-nakano.lg.jp/event/kanko/hanatomidori2026aki.html",
    "retrievedDate": "2026-09-22",
    "officialSource": true,
    "notes": "一般入場と多くの企画は予約不要。一部教室は中野区民対象の事前申込制で、申込締切は10月2日。当日企画は先着順の場合あり。"
  },
  {
    "id": "2026-10-17-nakano-komafes",
    "category": "kodomoto",
    "title": "KOMAFES2026（コマフェス）",
    "startDate": "2026-10-17",
    "endDate": "2026-10-18",
    "venueName": "中野区役所1階 ナカノバほか",
    "address": "東京都中野区中野4丁目11-19",
    "lat": 35.708958,
    "lng": 139.662901,
    "price": 0,
    "priceNote": "入場無料。一部ワークショップ等は有料。",
    "stayHours": 2.5,
    "reservation": "not_required",
    "targetAge": "親子・家族向け",
    "tags": [
      "hands_on",
      "workshop",
      "traditional_culture",
      "festival",
      "indoor"
    ],
    "summary": "区役所が子どもの遊び場になり、家族向けワークショップや10月17日の無料こども相撲体験、マルシェなどを楽しめる。",
    "sourceUrl": "https://www.komafes.info/",
    "retrievedDate": "2026-10-10",
    "officialSource": true,
    "notes": "17日11:00〜18:00、18日10:00〜18:00。無料こども相撲体験は17日13:00から。個別企画の参加条件・料金は主催者に確認。"
  },
  {
    "id": "2026-10-17-nakano-strider-park-fes",
    "category": "kodomoto",
    "title": "STRIDER PARK FES !! in 中野",
    "startDate": "2026-10-17",
    "endDate": "2026-10-18",
    "venueName": "中野セントラルパーク パークアベニュー",
    "address": "東京都中野区中野4丁目10",
    "lat": 35.70736,
    "lng": 139.66171,
    "price": 500,
    "priceNote": "パンプジャム500円／1回（2周）。無料試乗コーナーあり。よちよちスクール2,000円、フェイスペイント1,000〜2,000円。",
    "stayHours": 2,
    "reservation": "not_required",
    "targetAge": "ストライダー体験は主に1〜6歳（企画により異なる）",
    "tags": [
      "sports",
      "hands_on",
      "festival",
      "outdoor",
      "halloween"
    ],
    "summary": "全長約40mの起伏ある巨大コースをストライダーで走る体験や、無料試乗、初心者向けスクール、フェイスペイントを楽しめる。",
    "sourceUrl": "https://strider.jp/blogs/news/260810",
    "retrievedDate": "2026-10-10",
    "officialSource": true,
    "notes": "10:00〜16:30。通常の体験は事前申込不要。よちよちスクールの10:00枠は事前申込制、その他は当日先着受付。10月18日は事前エントリー制のファミリー仮装大賞も実施。"
  },
  {
    "id": "2026-10-18-shinjuku-treeing",
    "category": "kodomoto",
    "title": "ツリーイング @ SHINJUKU CHUO PARK",
    "startDate": "2026-10-18",
    "venueName": "新宿中央公園 芝生広場（東）",
    "address": "東京都新宿区西新宿2丁目11",
    "lat": 35.689527,
    "lng": 139.689454,
    "price": 2500,
    "priceNote": "1人1回50分2,500円。",
    "stayHours": 1,
    "reservation": "required",
    "targetAge": "小学生以上の心身ともに健康な方",
    "tags": [
      "sports",
      "hands_on",
      "outdoor",
      "nature"
    ],
    "summary": "インストラクターの指導で、自分の力で安全に木へ登るツリーイング体験。木について学びながら、自然の中で達成感を味わえる。",
    "sourceUrl": "https://shinjukuchuo-park.jp/events/event/2026/09/23/%E3%80%90%E5%8F%82%E5%8A%A0%E8%80%85%E5%8B%9F%E9%9B%86%EF%BC%81%E3%80%91%E3%83%84%E3%83%AA%E3%83%BC%E3%82%A4%E3%83%B3%E3%82%B0%E3%80%80%EF%BC%A0shinjuku-thuo-park/",
    "retrievedDate": "2026-10-03",
    "officialSource": true,
    "notes": "10:00・11:00・13:00・14:00の4回、各50分・定員10名。事前電話申込。雨天中止。"
  },
  {
    "id": "2026-10-23-kichijoji-halloween-festa",
    "category": "kodomoto",
    "title": "吉祥寺ハロウィンフェスタ2026 お菓子ラリー",
    "startDate": "2026-10-23",
    "endDate": "2026-10-25",
    "venueName": "吉祥寺駅周辺の参加店舗（本部：Jo-ji PLAZA.）",
    "address": "東京都武蔵野市吉祥寺本町2丁目4-14",
    "lat": 35.7061582,
    "lng": 139.5785065,
    "price": null,
    "priceNote": "参加費は選択コースによって異なる。参加証は子ども1人につき1枚必要。",
    "stayHours": 2.5,
    "reservation": "required",
    "targetAge": "0歳〜小学生の親子",
    "tags": [
      "halloween",
      "game",
      "hands_on",
      "festival",
      "outdoor"
    ],
    "summary": "仮装して吉祥寺の協力店舗を歩き、合言葉を伝えてお菓子を集める街ぐるみのラリー。25日にはキッズ仮装ファッションショーも開催。",
    "sourceUrl": "https://kichijoji-halloween.net/",
    "retrievedDate": "2026-10-10",
    "officialSource": true,
    "notes": "お菓子ラリーは各日11:00〜18:00。事前購入・参加証の郵送が必要。本部の住所を地図ピンに設定（実際は街なかを周遊）。公式サイトでは25日分は満員御礼表示。ファッションショーも要事前申込。"
  },
  {
    "id": "2026-10-24-nakano-tohoku-kizuna",
    "category": "kodomoto",
    "title": "2026なかの東北絆まつり",
    "startDate": "2026-10-24",
    "endDate": "2026-10-25",
    "venueName": "中野区役所・中野四季の森公園ほか",
    "address": "東京都中野区中野4丁目11-19",
    "lat": 35.708958,
    "lng": 139.662901,
    "price": 0,
    "priceNote": "入場無料。グルメ・物販などは別料金。",
    "stayHours": 3,
    "reservation": "not_required",
    "targetAge": "家族向け",
    "tags": [
      "festival",
      "food_stalls",
      "traditional_culture",
      "outdoor"
    ],
    "summary": "東北6県の食や文化が集まり、ねぶた展示、秋田竿燈まつり、郷土芸能、物産・グルメの屋台を会場を巡りながら楽しめる。",
    "sourceUrl": "https://www.city.tokyo-nakano.lg.jp/event/kanko/nakanotohokukizunamaturi2026.html",
    "retrievedDate": "2026-10-10",
    "officialSource": true,
    "notes": "24日10:00〜20:00、25日10:00〜18:00。区役所・公園・中野中学校グラウンドの複数会場。地図ピンは中野区役所。"
  },
  {
    "id": "2026-10-24-yoyogi-autumn-kids-festa",
    "category": "kodomoto",
    "title": "秋のキッズフェスタ2026",
    "startDate": "2026-10-24",
    "endDate": "2026-10-25",
    "venueName": "国立オリンピック記念青少年総合センター",
    "address": "東京都渋谷区代々木神園町3-1",
    "lat": 35.6765711,
    "lng": 139.6948861,
    "price": 0,
    "priceNote": "入場無料。一部プログラムは有料。",
    "stayHours": 3,
    "reservation": "not_required",
    "targetAge": "未就学児から小学生・家族向け（企画ごとに対象年齢が異なる）",
    "tags": [
      "hands_on",
      "workshop",
      "sports",
      "festival",
      "indoor",
      "outdoor"
    ],
    "summary": "スポーツ、ものづくり、自然体験など多彩な参加型プログラムが集まる親子向けイベント。予約が必要な企画もある。",
    "sourceUrl": "https://nyc.niye.go.jp/festa/page/2",
    "retrievedDate": "2026-10-14",
    "officialSource": true,
    "notes": "24日10:30〜17:00、25日10:30〜15:30。入場無料だが一部の体験は有料・事前予約制。各プログラムの詳細を要確認。"
  },
  {
    "id": "2026-10-28-sanrio-hello-kitty-lounge",
    "category": "kodomoto",
    "title": "Hello Kitty's Lounge",
    "startDate": "2026-10-28",
    "endDate": "2026-11-08",
    "venueName": "表参道ヒルズ 本館B3F スペース オー",
    "address": "東京都渋谷区神宮前4丁目12-10",
    "lat": 35.6672,
    "lng": 139.7086,
    "price": null,
    "stayHours": 1.5,
    "reservation": "recommended",
    "targetAge": "ハローキティが好きな親子・家族向け",
    "tags": [
      "sanrio",
      "hands_on",
      "craft",
      "indoor",
      "character"
    ],
    "summary": "サンリオの期間限定ラウンジで、自分だけのBGMやオリジナルのシュシュ作り、フォトスタジオでの記念撮影を楽しめる。",
    "character": "sanrio",
    "sourceUrl": "https://www.sanrio.co.jp/news/spots/kt-event-20261008/",
    "retrievedDate": "2026-10-10",
    "officialSource": true,
    "notes": "11:00〜20:00（最終入場19:30）。10月28日は16:00開始・事前予約者のみ入場可。その他の日は予約優先、空きがある場合に限り当日入場可。参加料金は公式ページで確認できず未設定。"
  },
  {
    "id": "2026-10-30-nakano-yakiimo-fes",
    "category": "kodomoto",
    "title": "やきいもフェス TOKYO 2026",
    "startDate": "2026-10-30",
    "endDate": "2026-11-08",
    "venueName": "中野四季の森公園 イベントエリア",
    "address": "東京都中野区中野4丁目13",
    "lat": 35.707914,
    "lng": 139.661357,
    "price": 0,
    "priceNote": "入場無料。飲食代別途、会場内はキャッシュレス決済のみ。",
    "stayHours": 2,
    "reservation": "not_required",
    "targetAge": "親子・家族向け",
    "tags": [
      "festival",
      "food_stalls",
      "outdoor",
      "seasonal"
    ],